{
  "source_id": "sources/web/001-fotosintesis-wikipedia-la-enciclopedia-libre.md",
  "vault_id": "subjects/biologia/topics/fotosintesis/sources/web/001-fotosintesis-wikipedia-la-enciclopedia-libre.md",
  "title": "Fotosíntesis - Wikipedia, la enciclopedia libre",
  "url": "https://es.wikipedia.org/wiki/Fotos%C3%ADntesis",
  "already_kept": false
}
